{
  "box_version": 1,
  "name": "爱尔兰 LTD Shopify + Stripe 独立站 OPC 样板",
  "data_mode": "demo",
  "reporting_currency": "EUR",
  "core": "core.finance",
  "business_models": ["industry.commerce"],
  "channels": ["channel.dtc_storefront"],
  "connectors": ["connector.file_import", "connector.shopify", "connector.stripe"],
  "features": ["feature.shopify_stripe_order_to_cash"],
  "entities": [{
    "id": "ie_store",
    "name": "爱尔兰独立站 Private Company Limited by Shares（演示）",
    "jurisdiction": "IE",
    "functional_currency": "EUR",
    "accounting_basis": "Irish_GAAP",
    "fiscal_year_end": "12-31",
    "tax_pack": "jurisdiction.ie_private_limited_company",
    "tax_registrations": ["ie_private_limited_company", "cro_company", "cro_annual_return", "tax_reference_confirmed", "corporation_tax", "ct1_filer", "vat_registration_review_required", "employer_registration_review_required"]
  }]
}
